[
  {
    "bundleId": "display-text-output-starter",
    "capabilityId": "display-text-output",
    "supportLevel": "supported",
    "requiredParts": ["arduino-uno", "breadboard-half", "oled-i2c-096", "jumper-wire"],
    "requiredArtifacts": ["source-claims", "capability-graph-entry", "part-capability", "pin-aliases", "validation-rule", "simulation-primitive", "render-footprint", "eval-supported-prompt", "eval-unsupported-counterexample", "browser-visible-verification"],
    "sourceClaimIds": ["arduino-uno-rev3-io-current-20ma", "arduino-uno-rev3-i2c-a4-a5", "ssd1306-i2c-oled-vcc-gnd-sda-scl", "breadboard-row-continuity-5-hole"],
    "canonicalFiles": ["registry/part-capabilities.json", "data/capability-graph.json", "data/render-footprints.json", "simulation/primitives.json", "ontology/pin-aliases.json"],
    "browserEvidenceIds": ["context-sufficiency-display-text-output"]
  },
  {
    "bundleId": "digital-light-output-starter",
    "capabilityId": "digital-light-output",
    "supportLevel": "supported",
    "requiredParts": ["arduino-uno", "breadboard-half", "led-5mm", "resistor-220", "jumper-wire"],
    "requiredArtifacts": ["source-claims", "capability-graph-entry", "part-capability", "pin-aliases", "validation-rule", "simulation-primitive", "render-footprint", "eval-supported-prompt", "eval-unsupported-counterexample", "browser-visible-verification"],
    "sourceClaimIds": ["arduino-uno-rev3-io-current-20ma", "arduino-uno-rev3-d9-pwm-pin", "breadboard-row-continuity-5-hole", "led-5mm-requires-current-limit", "led-5mm-anode-cathode-polarity"],
    "canonicalFiles": ["registry/part-capabilities.json", "data/capability-graph.json", "data/render-footprints.json", "simulation/primitives.json", "ontology/pin-aliases.json"],
    "browserEvidenceIds": ["context-sufficiency-digital-light-output"]
  },
  {
    "bundleId": "button-controlled-light-output-starter",
    "capabilityId": "button-controlled-light-output",
    "supportLevel": "supported",
    "requiredParts": ["arduino-uno", "breadboard-half", "button-tactile", "led-5mm", "resistor-220", "jumper-wire"],
    "requiredArtifacts": ["source-claims", "capability-graph-entry", "part-capability", "pin-aliases", "validation-rule", "simulation-primitive", "render-footprint", "eval-supported-prompt", "eval-unsupported-counterexample", "browser-visible-verification"],
    "sourceClaimIds": ["arduino-uno-rev3-io-current-20ma", "breadboard-row-continuity-5-hole", "led-5mm-requires-current-limit", "led-5mm-anode-cathode-polarity", "tactile-button-normally-open"],
    "canonicalFiles": ["registry/part-capabilities.json", "data/capability-graph.json", "data/render-footprints.json", "simulation/primitives.json", "ontology/pin-aliases.json"],
    "browserEvidenceIds": ["context-sufficiency-button-controlled-light-output"]
  },
  {
    "bundleId": "sound-alert-output-starter",
    "capabilityId": "sound-alert-output",
    "supportLevel": "supported",
    "requiredParts": ["arduino-uno", "breadboard-half", "piezo-buzzer", "jumper-wire"],
    "requiredArtifacts": ["source-claims", "capability-graph-entry", "part-capability", "pin-aliases", "validation-rule", "simulation-primitive", "render-footprint", "eval-supported-prompt", "eval-unsupported-counterexample", "browser-visible-verification"],
    "sourceClaimIds": ["arduino-uno-rev3-io-current-20ma", "breadboard-row-continuity-5-hole", "piezo-buzzer-arduino-tone-output"],
    "canonicalFiles": ["registry/part-capabilities.json", "data/capability-graph.json", "data/render-footprints.json", "simulation/primitives.json", "ontology/pin-aliases.json"],
    "browserEvidenceIds": ["context-sufficiency-sound-alert-output"]
  },
  {
    "bundleId": "servo-motion-output-starter",
    "capabilityId": "servo-motion-output",
    "supportLevel": "supported",
    "requiredParts": ["arduino-uno", "breadboard-half", "micro-servo", "jumper-wire"],
    "requiredArtifacts": ["source-claims", "capability-graph-entry", "part-capability", "pin-aliases", "validation-rule", "simulation-primitive", "render-footprint", "eval-supported-prompt", "eval-unsupported-counterexample", "browser-visible-verification"],
    "sourceClaimIds": ["arduino-uno-rev3-io-current-20ma", "arduino-uno-rev3-d9-pwm-pin", "breadboard-row-continuity-5-hole", "micro-servo-three-wire-pwm-signal"],
    "canonicalFiles": ["registry/part-capabilities.json", "data/capability-graph.json", "data/render-footprints.json", "simulation/primitives.json", "ontology/pin-aliases.json"],
    "browserEvidenceIds": ["context-sufficiency-servo-motion-output"]
  }
]
